{
  "schema": "mods-brain.api-surface.v1",
  "claude_code_version": "2.1.288",
  "source_file": "claude-code/index.d.ts",
  "source_sha256": "d0531eb1b9f9a05f5da139cdce07dacf59171a8608d8a3c262902f44c368ed5e",
  "line_count": 14973,
  "events": {
    "engine": [
      {
        "name": "tool.call",
        "line": 3741,
        "summary": "",
        "signature": "'tool.call': ToolCallInput;"
      },
      {
        "name": "tool.check",
        "line": 3753,
        "summary": "",
        "signature": "'tool.check': ToolCheckInput;"
      },
      {
        "name": "ui.render",
        "line": 3765,
        "summary": "",
        "signature": "'ui.render': RenderInput;"
      },
      {
        "name": "ui.resolve",
        "line": 3774,
        "summary": "",
        "signature": "'ui.resolve': ResolveInput;"
      },
      {
        "name": "ui.press",
        "line": 3783,
        "summary": "",
        "signature": "'ui.press': UiPressArgument;"
      },
      {
        "name": "ui.input",
        "line": 3792,
        "summary": "",
        "signature": "'ui.input': UiInputArgument;"
      },
      {
        "name": "ui.select",
        "line": 3801,
        "summary": "",
        "signature": "'ui.select': UiSelectArgument;"
      },
      {
        "name": "ui.message",
        "line": 3810,
        "summary": "",
        "signature": "'ui.message': UiMessageArgument;"
      },
      {
        "name": "ui.scroll",
        "line": 3822,
        "summary": "",
        "signature": "'ui.scroll': UiScrollInput;"
      },
      {
        "name": "ui.focus",
        "line": 3834,
        "summary": "",
        "signature": "'ui.focus': UiFocusInput;"
      },
      {
        "name": "agent.offer",
        "line": 3845,
        "summary": "",
        "signature": "'agent.offer': AgentOfferInput;"
      },
      {
        "name": "agent.spawn",
        "line": 3854,
        "summary": "",
        "signature": "'agent.spawn': AgentSpawnInput;"
      },
      {
        "name": "prompt.submit",
        "line": 3863,
        "summary": "",
        "signature": "'prompt.submit': PromptSubmitInput;"
      },
      {
        "name": "prompt.fill",
        "line": 3875,
        "summary": "",
        "signature": "'prompt.fill': PromptFillInput;"
      },
      {
        "name": "prompt.suggest",
        "line": 3887,
        "summary": "",
        "signature": "'prompt.suggest': PromptSuggestInput;"
      },
      {
        "name": "prompt.edit",
        "line": 3899,
        "summary": "",
        "signature": "'prompt.edit': PromptEditInput;"
      },
      {
        "name": "prompt.section",
        "line": 3911,
        "summary": "",
        "signature": "'prompt.section': PromptSectionInput;"
      },
      {
        "name": "prompt.context",
        "line": 3923,
        "summary": "",
        "signature": "'prompt.context': PromptContextInput;"
      },
      {
        "name": "prompt.compose",
        "line": 3932,
        "summary": "",
        "signature": "'prompt.compose': PromptComposeInput;"
      },
      {
        "name": "prompt.attachment",
        "line": 3944,
        "summary": "",
        "signature": "'prompt.attachment': PromptAttachmentInput;"
      },
      {
        "name": "tool.describe",
        "line": 3958,
        "summary": "",
        "signature": "'tool.describe': ToolDescribeInput;"
      },
      {
        "name": "command.run",
        "line": 3970,
        "summary": "",
        "signature": "'command.run': CommandRunInput;"
      },
      {
        "name": "command.describe",
        "line": 3982,
        "summary": "",
        "signature": "'command.describe': CommandDescribeInput;"
      },
      {
        "name": "config.set",
        "line": 3994,
        "summary": "",
        "signature": "'config.set': ConfigSetInput;"
      },
      {
        "name": "config.describe",
        "line": 4006,
        "summary": "",
        "signature": "'config.describe': ConfigDescribeInput;"
      },
      {
        "name": "telemetry.log",
        "line": 4018,
        "summary": "",
        "signature": "'telemetry.log': TelemetryLogInput;"
      },
      {
        "name": "telemetry.mark",
        "line": 4029,
        "summary": "",
        "signature": "'telemetry.mark': TelemetryMarkInput;"
      },
      {
        "name": "skill.prompt",
        "line": 4040,
        "summary": "",
        "signature": "'skill.prompt': SkillPromptInput;"
      },
      {
        "name": "attribution.text",
        "line": 4051,
        "summary": "",
        "signature": "'attribution.text': AttributionTextInput;"
      },
      {
        "name": "session.start",
        "line": 4063,
        "summary": "",
        "signature": "'session.start': SessionStartInput;"
      },
      {
        "name": "session.receive",
        "line": 4075,
        "summary": "",
        "signature": "'session.receive': SessionReceiveInput;"
      },
      {
        "name": "session.append",
        "line": 4087,
        "summary": "",
        "signature": "'session.append': SessionAppendInput;"
      },
      {
        "name": "session.send",
        "line": 4099,
        "summary": "",
        "signature": "'session.send': SessionSendInput;"
      },
      {
        "name": "session.compact",
        "line": 4111,
        "summary": "",
        "signature": "'session.compact': SessionCompactInput;"
      },
      {
        "name": "session.attach",
        "line": 4123,
        "summary": "",
        "signature": "'session.attach': SessionAttachInput;"
      },
      {
        "name": "session.detach",
        "line": 4131,
        "summary": "",
        "signature": "'session.detach': SessionDetachInput;"
      },
      {
        "name": "session.measure",
        "line": 4143,
        "summary": "",
        "signature": "'session.measure': SessionMeasureInput;"
      },
      {
        "name": "session.end",
        "line": 4155,
        "summary": "",
        "signature": "'session.end': SessionEndInput;"
      },
      {
        "name": "plugin.register",
        "line": 4167,
        "summary": "",
        "signature": "'plugin.register': PluginRegisterInput;"
      },
      {
        "name": "turn.start",
        "line": 4172,
        "summary": "",
        "signature": "'turn.start': TurnStartInput;"
      },
      {
        "name": "turn.step",
        "line": 4181,
        "summary": "",
        "signature": "'turn.step': TurnStepInput;"
      },
      {
        "name": "turn.complete",
        "line": 4190,
        "summary": "",
        "signature": "'turn.complete': TurnCompleteInput;"
      },
      {
        "name": "engine.create",
        "line": 4199,
        "summary": "",
        "signature": "'engine.create': EngineCreateInput;"
      }
    ],
    "op": [
      {
        "name": "model.complete",
        "line": 6410,
        "summary": "",
        "signature": "'model.complete': ModelCompleteRequest;"
      },
      {
        "name": "model.classify",
        "line": 6414,
        "summary": "",
        "signature": "'model.classify': {"
      },
      {
        "name": "model.fork",
        "line": 6422,
        "summary": "",
        "signature": "'model.fork': ModelForkRequest;"
      },
      {
        "name": "audio.play",
        "line": 6427,
        "summary": "",
        "signature": "'audio.play': {"
      },
      {
        "name": "audio.speak",
        "line": 6435,
        "summary": "",
        "signature": "'audio.speak': SpeakRequest;"
      },
      {
        "name": "mcp.call",
        "line": 6439,
        "summary": "",
        "signature": "'mcp.call': {"
      },
      {
        "name": "mcp.connect",
        "line": 6447,
        "summary": "",
        "signature": "'mcp.connect': {"
      },
      {
        "name": "session.cwd",
        "line": 6453,
        "summary": "",
        "signature": "'session.cwd': NoArgs;"
      },
      {
        "name": "session.root",
        "line": 6457,
        "summary": "",
        "signature": "'session.root': NoArgs;"
      },
      {
        "name": "session.model",
        "line": 6461,
        "summary": "",
        "signature": "'session.model': NoArgs;"
      },
      {
        "name": "session.turns",
        "line": 6465,
        "summary": "",
        "signature": "'session.turns': NoArgs;"
      },
      {
        "name": "session.id",
        "line": 6469,
        "summary": "",
        "signature": "'session.id': NoArgs;"
      },
      {
        "name": "session.messages",
        "line": 6474,
        "summary": "",
        "signature": "'session.messages': SessionMessagesArgs;"
      },
      {
        "name": "session.repo",
        "line": 6478,
        "summary": "",
        "signature": "'session.repo': NoArgs;"
      },
      {
        "name": "session.surface",
        "line": 6484,
        "summary": "",
        "signature": "'session.surface': NoArgs;"
      },
      {
        "name": "session.surfaces",
        "line": 6488,
        "summary": "",
        "signature": "'session.surfaces': NoArgs;"
      },
      {
        "name": "session.authorize",
        "line": 6492,
        "summary": "",
        "signature": "'session.authorize': NoArgs;"
      },
      {
        "name": "session.usage",
        "line": 6496,
        "summary": "",
        "signature": "'session.usage': SessionUsageArgs;"
      },
      {
        "name": "session.version",
        "line": 6500,
        "summary": "",
        "signature": "'session.version': NoArgs;"
      },
      {
        "name": "turn.abort",
        "line": 6504,
        "summary": "",
        "signature": "'turn.abort': {"
      },
      {
        "name": "prompt.read",
        "line": 6510,
        "summary": "",
        "signature": "'prompt.read': NoArgs;"
      },
      {
        "name": "tool.list",
        "line": 6514,
        "summary": "",
        "signature": "'tool.list': NoArgs;"
      },
      {
        "name": "tool.register",